HCI sniffer - Bluetooth packet analyzer ver 5.23
device: hci0 snap_len: 1500 filter: 0xffffffff
< HCI Command: LE Set Random Address (0x08|0x0005) plen 6
    bdaddr 16:79:5A:B0:82:24
> HCI Event: Command Complete (0x0e) plen 4
    LE Set Random Address (0x08|0x0005) ncmd 1
    status 0x00
< HCI Command: LE Set Scan Parameters (0x08|0x000b) plen 7
    type 0x01 (active)
    interval 22.500ms window 11.250ms
    own address: 0x01 (Random) policy: All
> HCI Event: Command Complete (0x0e) plen 4
    LE Set Scan Parameters (0x08|0x000b) ncmd 1
    status 0x00
< HCI Command: LE Set Scan Enable (0x08|0x000c) plen 2
    value 0x01 (scanning enabled)
    filter duplicates 0x01 (enabled)
> HCI Event: Command Complete (0x0e) plen 4
    LE Set Scan Enable (0x08|0x000c) ncmd 1
    status 0x00
< HCI Command: Inquiry (0x01|0x0001) plen 5
    lap 0x9e8b33 len 8 num 0
> HCI Event: Command Status (0x0f) plen 4
    Inquiry (0x01|0x0001) status 0x00 ncmd 1
> HCI Event: LE Meta Event (0x3e) plen 36
    LE Advertising Report
      ADV_IND - Connectable undirected advertising (0)
      bdaddr E3:49:48:1C:4D:E6 (Random)
      Flags: 0x06
      TX power level: 0
      Unknown type 0x07 with 16 bytes data
      RSSI: -75
> HCI Event: LE Meta Event (0x3e) plen 35
    LE Advertising Report
      SCAN_RSP - Scan Response (4)
      bdaddr E3:49:48:1C:4D:E6 (Random)
      Complete local name: 'Adafruit Bluefruit LE'
      RSSI: -75
> HCI Event: LE Meta Event (0x3e) plen 36
    LE Advertising Report
      ADV_IND - Connectable undirected advertising (0)
      bdaddr E3:49:48:1C:4D:E6 (Random)
      Flags: 0x06
      TX power level: 0
      Unknown type 0x07 with 16 bytes data
      RSSI: -82
> HCI Event: LE Meta Event (0x3e) plen 35
    LE Advertising Report
      SCAN_RSP - Scan Response (4)
      bdaddr E3:49:48:1C:4D:E6 (Random)
      Complete local name: 'Adafruit Bluefruit LE'
      RSSI: -82
> HCI Event: LE Meta Event (0x3e) plen 36
    LE Advertising Report
      ADV_IND - Connectable undirected advertising (0)
      bdaddr E3:49:48:1C:4D:E6 (Random)
      Flags: 0x06
      TX power level: 0
      Unknown type 0x07 with 16 bytes data
      RSSI: -83
> HCI Event: LE Meta Event (0x3e) plen 36
    LE Advertising Report
      ADV_IND - Connectable undirected advertising (0)
      bdaddr E3:49:48:1C:4D:E6 (Random)
      Flags: 0x06
      TX power level: 0
      Unknown type 0x07 with 16 bytes data
      RSSI: -74
> HCI Event: LE Meta Event (0x3e) plen 35
    LE Advertising Report
      SCAN_RSP - Scan Response (4)
      bdaddr E3:49:48:1C:4D:E6 (Random)
      Complete local name: 'Adafruit Bluefruit LE'
      RSSI: -74
> HCI Event: LE Meta Event (0x3e) plen 36
    LE Advertising Report
      ADV_IND - Connectable undirected advertising (0)
      bdaddr E3:49:48:1C:4D:E6 (Random)
      Flags: 0x06
      TX power level: 0
      Unknown type 0x07 with 16 bytes data
      RSSI: -74
> HCI Event: Extended Inquiry Result (0x2f) plen 255
    bdaddr 7C:E9:D3:EA:1E:D8 mode 1 clkoffset 0x1cd3 class 0x3e010c rssi -83
    Complete local name: 'EN-EC-SPLG27-D'
    TX power level: 0
    Shortened service classes: 0x110b 0x1124
> HCI Event: LE Meta Event (0x3e) plen 36
    LE Advertising Report
      ADV_IND - Connectable undirected advertising (0)
      bdaddr E3:49:48:1C:4D:E6 (Random)
      Flags: 0x06
      TX power level: 0
      Unknown type 0x07 with 16 bytes data
      RSSI: -75
> HCI Event: LE Meta Event (0x3e) plen 35
    LE Advertising Report
      SCAN_RSP - Scan Response (4)
      bdaddr E3:49:48:1C:4D:E6 (Random)
      Complete local name: 'Adafruit Bluefruit LE'
      RSSI: -75
> HCI Event: LE Meta Event (0x3e) plen 36
    LE Advertising Report
      ADV_IND - Connectable undirected advertising (0)
      bdaddr E3:49:48:1C:4D:E6 (Random)
      Flags: 0x06
      TX power level: 0
      Unknown type 0x07 with 16 bytes data
      RSSI: -75
> HCI Event: LE Meta Event (0x3e) plen 35
    LE Advertising Report
      SCAN_RSP - Scan Response (4)
      bdaddr E3:49:48:1C:4D:E6 (Random)
      Complete local name: 'Adafruit Bluefruit LE'
      RSSI: -75
> HCI Event: LE Meta Event (0x3e) plen 36
    LE Advertising Report
      ADV_IND - Connectable undirected advertising (0)
      bdaddr E3:49:48:1C:4D:E6 (Random)
      Flags: 0x06
      TX power level: 0
      Unknown type 0x07 with 16 bytes data
      RSSI: -82
> HCI Event: LE Meta Event (0x3e) plen 35
    LE Advertising Report
      SCAN_RSP - Scan Response (4)
      bdaddr E3:49:48:1C:4D:E6 (Random)
      Complete local name: 'Adafruit Bluefruit LE'
      RSSI: -82
> HCI Event: LE Meta Event (0x3e) plen 36
    LE Advertising Report
      ADV_IND - Connectable undirected advertising (0)
      bdaddr E3:49:48:1C:4D:E6 (Random)
      Flags: 0x06
      TX power level: 0
      Unknown type 0x07 with 16 bytes data
      RSSI: -82
> HCI Event: LE Meta Event (0x3e) plen 35
    LE Advertising Report
      SCAN_RSP - Scan Response (4)
      bdaddr E3:49:48:1C:4D:E6 (Random)
      Complete local name: 'Adafruit Bluefruit LE'
      RSSI: -83
> HCI Event: LE Meta Event (0x3e) plen 36
    LE Advertising Report
      ADV_IND - Connectable undirected advertising (0)
      bdaddr E3:49:48:1C:4D:E6 (Random)
      Flags: 0x06
      TX power level: 0
      Unknown type 0x07 with 16 bytes data
      RSSI: -74
> HCI Event: LE Meta Event (0x3e) plen 35
    LE Advertising Report
      SCAN_RSP - Scan Response (4)
      bdaddr E3:49:48:1C:4D:E6 (Random)
      Complete local name: 'Adafruit Bluefruit LE'
      RSSI: -73
> HCI Event: LE Meta Event (0x3e) plen 36
    LE Advertising Report
      ADV_IND - Connectable undirected advertising (0)
      bdaddr E3:49:48:1C:4D:E6 (Random)
      Flags: 0x06
      TX power level: 0
      Unknown type 0x07 with 16 bytes data
      RSSI: -74
> HCI Event: LE Meta Event (0x3e) plen 35
    LE Advertising Report
      SCAN_RSP - Scan Response (4)
      bdaddr E3:49:48:1C:4D:E6 (Random)
      Complete local name: 'Adafruit Bluefruit LE'
      RSSI: -74
